<class xmlns:xsi="http://www.w3.org/2001/XMLSchema-instance" xsi:noNamespaceSchemaLocation="02_Student.xsd">
    <student>
        <firstname>
           Alex 
        </firstname>
        <lastname>
            Bell
        </lastname>
        <age>
            20
        </age>
    </student>
    <student>
        <firstname>Martin</firstname>
        <lastname>
            Rockwell
        </lastname>
        <age>
            19
        </age>
    </student>
    <student>
        <firstname>
           Stephen
        </firstname>
        <lastname>
            Gort
        </lastname>
        <age>
            22
        </age>
    </student>
    <subject>
        Mathematics
    </subject>
    <hour>10</hour>
</class>